{
  "schema_version": "1.0.0",
  "standard": "jankurai",
  "standard_version": "0.9.0",
  "auditor_version": "1.7.0",
  "source_report": "agent/badge-source/repo-score.json",
  "source_badge_fingerprint": "sha256:a690bcf14861fb73948769caf1a6752959a1fb2f72c2ed2b7335cc13308db447",
  "score": 86,
  "raw_score": 86,
  "minimum_score": 85,
  "decision": "pass",
  "passed": true,
  "findings": 2,
  "hard_findings": 0,
  "soft_findings": 2,
  "caps": 0,
  "conformance_level": "HL3",
  "badge_svg": "agent/jankurai-badge.svg",
  "readme": "README.md",
  "markdown": "<!-- jankurai-badge:start -->\n[![Jankurai score: 86/100](agent/jankurai-badge.svg)](agent/jankurai-badge.json)\n<!-- jankurai-badge:end -->\n"
}
